{
  "id": "proj-2026-0007",
  "slug": "reduce-invoice-cycle-time",
  "title": "Reduce Invoice Processing Cycle Time",
  "sponsor": "Jane Smith, VP Finance",
  "owner": "Kyle Go",
  "team": ["Kyle Go", "Alex Kim", "Priya Patel"],
  "businessUnit": "Finance",
  "status": "Completed",
  "currentPhase": "Control",
  "startDate": "2026-02-01",
  "targetCompletionDate": "2026-09-30",
  "actualCompletionDate": "2026-09-12",
  "financialImpact": {
    "type": "Hard Savings",
    "annualizedAmount": 125000,
    "currency": "EUR",
    "notes": "Based on FTE hours reduced x loaded rate"
  },
  "define": {
    "problemStatement": "Invoice processing currently takes an average of 9.4 days from receipt to payment approval, causing late payment penalties and strained supplier relationships.",
    "goalStatement": "Reduce average invoice processing cycle time from 9.4 days to under 3 days by Q3 2026, without increasing headcount.",
    "scope": {
      "inScope": ["Accounts Payable invoice intake through approval", "PO-matched and non-PO invoices"],
      "outOfScope": ["Payment execution/banking", "Vendor onboarding process"]
    },
    "businessCase": "Late payment penalties cost approximately €140K annually and are damaging key supplier relationships. Reducing cycle time also frees up 1.5 FTE of rework capacity.",
    "team": {
      "sponsor": "Jane Smith, VP Finance",
      "blackBelt": "Kyle Go",
      "processOwner": "Alex Kim, AP Manager",
      "members": ["Priya Patel", "Sam Torres", "Jordan Lee"]
    },
    "sipoc": {
      "suppliers": ["Vendors", "Purchasing dept"],
      "inputs": ["Invoice (email/mail/EDI)", "Purchase order", "Goods receipt"],
      "process": ["Receive invoice", "Match to PO", "Route for approval", "Post to ERP", "Schedule payment"],
      "outputs": ["Approved invoice", "Scheduled payment"],
      "customers": ["Vendors", "Finance leadership", "Internal budget owners"]
    },
    "voc": [
      { "source": "Vendor satisfaction survey", "need": "Faster, predictable payment", "criticalToQuality": "Cycle time under 3 business days" },
      { "source": "AP team interviews", "need": "Less manual re-keying", "criticalToQuality": "Fewer touchpoints per invoice" }
    ]
  },
  "measure": {
    "dataCollectionPlan": [
      { "metric": "Cycle time (days)", "operationalDefinition": "Business days from invoice receipt timestamp to approval timestamp in ERP", "dataSource": "ERP timestamps", "sampleSize": 200, "collectionPeriod": "March 2026" },
      { "metric": "Touch count", "operationalDefinition": "Number of times an invoice is handled by a person before approval", "dataSource": "Workflow system log", "sampleSize": 200, "collectionPeriod": "March 2026" }
    ],
    "baselineMetrics": [
      { "metric": "Avg cycle time", "baselineValue": 9.4, "unit": "days" },
      { "metric": "Avg touch count", "baselineValue": 4.2, "unit": "touches" }
    ],
    "processSigma": 1.8,
    "cpk": 0.6,
    "notes": "Baseline sample pulled from a random 200-invoice sample across all vendor categories in March 2026."
  },
  "analyze": {
    "rootCauseAnalysis": {
      "fishbone": {
        "categories": [
          { "category": "Method", "causes": ["No standard PO-matching rule", "Manual routing for exceptions"] },
          { "category": "Machine", "causes": ["ERP requires manual data entry for non-EDI invoices"] },
          { "category": "Material", "causes": ["Incomplete PO numbers on invoices"] },
          { "category": "Manpower", "causes": ["Single approver bottleneck for invoices over €5K"] },
          { "category": "Measurement", "causes": ["No visibility into invoice aging until overdue"] },
          { "category": "Environment", "causes": ["Approvers often traveling, no mobile approval option"] }
        ]
      },
      "fiveWhys": [
        {
          "problem": "Invoices are delayed past 3 days",
          "whys": [
            "Approval is waiting on a single manager",
            "That manager has no backup approver",
            "The approval workflow was never configured with a delegate",
            "The workflow was set up ad hoc without a formal RACI",
            "There was no standard onboarding checklist for new approval workflows"
          ]
        }
      ]
    },
    "pareto": [
      { "category": "Missing PO number", "count": 42 },
      { "category": "Single-approver bottleneck", "count": 38 },
      { "category": "Manual data entry errors", "count": 30 },
      { "category": "Approver unavailable/traveling", "count": 22 },
      { "category": "Other", "count": 12 }
    ],
    "findings": "The top three causes (missing PO numbers, single-approver bottlenecks, and manual data entry errors) account for over 75% of delays, matching the Pareto principle and pointing to fixable process/design issues rather than volume or staffing constraints."
  },
  "improve": {
    "solutions": [
      { "description": "Required PO number field enforced at invoice intake (email parsing + web portal validation)", "owner": "Priya Patel", "implementationDate": "2026-06-01" },
      { "description": "Added delegate approver rules and mobile approval capability", "owner": "Alex Kim", "implementationDate": "2026-06-15" },
      { "description": "Enabled OCR-based data capture for non-EDI invoices to reduce manual entry", "owner": "Sam Torres", "implementationDate": "2026-06-20" }
    ],
    "pilotResults": {
      "pilotPeriod": "2026-06-01 to 2026-06-30",
      "metricsBefore": [{ "metric": "Avg cycle time", "value": 9.4, "unit": "days" }],
      "metricsAfter": [{ "metric": "Avg cycle time", "value": 3.1, "unit": "days" }],
      "summary": "30-day pilot across the Finance and Ops vendor categories showed a 67% reduction in cycle time with no increase in rework rate."
    }
  },
  "control": {
    "controlPlan": [
      { "metric": "Cycle time (days)", "target": "< 3 days", "frequency": "Weekly", "owner": "Alex Kim, AP Manager", "responseIfOutOfControl": "Escalate to Process Owner; review exception queue within 24 hours" },
      { "metric": "% invoices missing PO", "target": "< 5%", "frequency": "Weekly", "owner": "Priya Patel", "responseIfOutOfControl": "Notify vendor management to follow up with offending supplier" }
    ],
    "monitoringMetrics": ["Avg cycle time", "% invoices missing PO", "Approver response time"],
    "standardWorkDocs": [
      { "title": "Invoice Processing SOP v2", "url": "https://intranet.example.com/sops/invoice-processing-v2" },
      { "title": "Approval Delegation Policy", "url": "https://intranet.example.com/policies/approval-delegation" }
    ],
    "finalResults": {
      "summary": "Full rollout sustained a 2.7-day average cycle time over the 90 days following implementation, exceeding the 3-day goal.",
      "actualAnnualizedSavings": 118000,
      "cycleTimeAfter": 2.7
    }
  },
  "createdAt": "2026-02-01T10:00:00Z",
  "updatedAt": "2026-09-12T09:00:00Z"
}
